,title,company,description,location,state,salary,jobtype,skill,degree
0,Data Analyst, Ampcus Inc ,"Hello,   Greetings from Ampcus Inc. Ampcus is a technology services consulting company. Ampcus Inc. is a Global leader in end-to-end IT   BACHELOR  ness Solutions and Services with latest technologies. We are listed among the top 50 fastest growing companies in USA. We work closely with our clients for Talent acquisition.  We are looking for an Principal-Pred/Pres Analytics. This is 6+ months Position. Your resume is a very good match for this opportunity, please review the job description below and ple"," Ampcus Inc  Alpharetta, GA, USA",GA,,,,BACHELOR
1,Data Scientist, Horn Solutions Inc. ,Horn Solutions has partnered with a client in search of a talented Data Science Engineer to join their team for a new data project where they will be standing up their Data Science environment from scratch. This client is located in Las Colinas and the position will be partially on site. The Position:  We are looking for an experienced data engineer to join our team. You will use various methods to transform raw data into useful data systems. The ideal candidate should have strong analytical ski," Horn Solutions Inc.  Irving, TX, USA",TX,,,,
2,Data Analyst, comScore ,"May 14, 2021  Manager, Data Science, Analytics Job Description  Job Title: Manager, Data Science, Analytics Location: Reston, VA About this Role: This position draws on expertise in analysis, big data, and operations to manage and improve the processes that produce Comscore's cross-platform, digital, and television audience data. Clients around the globe rely on this information to shape   BACHELOR  ness strategies and fuel advertisement buying and selling. This dedicated leader motivates staff and coll"," comScore  Reston, VA, USA",VA,,,,BACHELOR
3,Data Analyst, SAIC ,"Description JOB DESCRIPTION: The Pilot Training Next (PTN) contract is seeking a Data VISUALIZATION Specialist to support the data analysis and reporting capability for the Air Education and Training Command within the United States Air Force. The team is seeking a motivated individual with a background in data VISUALIZATION and analysis. We are a team of ""doers"" with a   BACHELOR   towards action and have a proven track record of implementing innovative technology solutions to solve complex challenges."," SAIC  Austin, TX, USA",TX,,,VISUALIZATION,BACHELOR
4,Data Analyst, SAIC ,"Description JOB DESCRIPTION: The Pilot Training Next (PTN) contract is seeking a Data VISUALIZATION Specialist to support the data analysis and reporting capability for the Air Education and Training Command within the United States Air Force. The team is seeking a motivated individual with a background in data VISUALIZATION and analysis. We are a team of ""doers"" with a   BACHELOR   towards action and have a proven track record of implementing innovative technology solutions to solve complex challenges."," SAIC  JBSA Randolph, TX, USA",TX,,,VISUALIZATION,BACHELOR
5,Data Analyst, SAIC ,"Description JOB DESCRIPTION: The Pilot Training Next (PTN) contract is seeking a Data VISUALIZATION Specialist to support the data analysis and reporting capability for the Air Education and Training Command within the United States Air Force. The team is seeking a motivated individual with a background in data VISUALIZATION and analysis. We are a team of ""doers"" with a   BACHELOR   towards action and have a proven track record of implementing innovative technology solutions to solve complex challenges."," SAIC  Huntsville, AL, USA",AL,,,VISUALIZATION,BACHELOR
6,Data Engineer, Infinity Tech Group Inc ,"Position: Data Engineer Location: NY OR Charlotte, NC (Remote till Covid)  Duration: 9 to 12 months contract   Must have extensive hands on experience in designing, developing, and maintaining software solutions in Big Data and Data Science PlatformsExperience building E2E Data Science using Streaming and Big Data platformHands on experience on implementing  CI/CD using the Atlassian ecosystemExtensive hands on experience in designing, developing, and maintaining software frameworks using Kafka,"," Infinity Tech Group Inc  Charlotte, NC, USA",NC,,,,
7,Data Analyst, Discover ,"Discover. A brighter future. With us, you'll do meaningful work from Day 1. Our collaborative culture is built on three core behaviors: We Play to Win, We Get Better Every Day & We Succeed Together. And we mean it - we want you to grow and make a difference at one of the world's leading digital banking and payments companies. We value what makes you unique so that you have an opportunity to shine. Come build your future, while being the reason millions of people find a brighter financial future "," Discover  Riverwoods, IL, USA",IL,,,,
8,Data Scientist, Corus Consulting ,"We are looking for candidates that are able to manage Data without supervision, with high attention to details, with a LOGICAL approach and DATA modeling management experience.   Scorecard development would be a PLUS.   Languages: SQL, PYTHON R and SAS.     Job Information Job Title: Sr. Associate, Risk Modeling/Data Science Job Code:   Job Family: Risk Job Function: Risk Management Job Family Description: Monitors activities to minimize the company's exposure to risk. Activities may include qu"," Corus Consulting  Dallas, TX, USA",TX,,,"PYTHON,R",
10,Data Analyst, DISQO ,"DISQO is changing the way that the world's largest   BACHELOR  ds, agencies and consumer intelligence companies get to know their consumers. We've built the first identity-  BACHELOR  d platform that combines consumer attitudes and behaviors together to power the most accurate and predictive insights solutions for our customers, and we do all of that with the willing participation of our consumers and without using outdated technologies like third-party cookies. We help our customers get a cross-platform view i"," DISQO  Glendale, CA, USA",CA,,,,BACHELOR
11,Data Engineer, OMG Technologies ,"Role: Data Science/Data Engineering Consultant with Strong Pharmaceutical Commercial Data Experience  We are looking to hire a consultant with the below skills set and experience for one of our clients within the Pharmaceutical industry, a major pharmaceutical company. This is 6-months Contract opportunity with a potential to get extended or hired at the end of the contracting period. Interested candidates may share updated resume to Carolina - OMG Technologies.com *Ideal Candidate is an establi"," OMG Technologies  Princeton, NJ, USA",NJ,,,,
12,Data Analyst, TransUnion ,"What We'll Bring: At TransUnion, we have a welcoming and energetic environment that encourages collaboration and innovation.  We are consistently exploring new technologies and tools to be agile. This environment gives our people the opportunity to hone current skills and build new capabilities, while discovering their genius. Come be a part of our team - you'll work with great people, pioneering products and cutting-edge technology.  Protecting the health and wellness of our associates and cand"," TransUnion  Chicago, IL, USA",IL,,,,
14,Data Analyst, Fiserv ,"Technology Analyst Program - Cyber, Infrastructure, Data Science, IT Project Management -Alpharetta / Marietta Fiserv's Technology Analyst Program is an early career development program where candidates experience two one-year assignments in a core functional technology role. Each assignment builds upon the other and together will provide a breadth of experience in the   BACHELOR  ness world and unique to you! We are looking for university graduates with drive, passion, and an evolving target for their "," Fiserv  Alpharetta, GA, USA",GA,,,,BACHELOR
15,Data Scientist, Wizard Tech Solutions Inc ,"Some examples of what you'll be doing: Develop strong collaborative partnerships with   BACHELOR  ness and operations leadersUse compelling data, deep   BACHELOR  ness acumen and exceptional communication to drive   BACHELOR  ness strategy and executionIdentify   BACHELOR  ness challenges, performance bottlenecks and growth opportunitiesConduct insightful analyses on major trends, thinking 3 steps ahead to guide emerging strategyPropose rapid experiments to test the effect of new strategies or initiatives, and iterate quicklyC"," Wizard Tech Solutions Inc  Austin, TX, USA",TX,,,,BACHELOR
16,Data Scientist, comScore ,"April 15, 2021  Data Scientist, Panel Science Job Description  Job Title: Data Scientist, Panel Science Location:  Chicago, IL  About this Role: Comscore is a leading big data technology company that measures what matters to make cross-platform audiences and advertising more valuable. We are seeking a Data Scientist, Panel Science to mine our large-scale global consumer panel data sets and provide insights to help inform our methodologies and data insights around the world. The Data Scientist wi"," comScore  Chicago, IL, USA",IL,,,,
17,Data Analyst, Deloitte ,"Life Sciences Manager - Data Analytics  Work you'll do  A Manager at Deloitte will manage and deliver components of client engagements that design and implement technology-  BACHELOR  d   BACHELOR  ness solutions for large multi-national organizations. Key responsibilities will include:  Manage teams in the identification of   BACHELOR  ness requirements, functional design, process design (including scenario design, flow mapping), prototyping, testing, training, defining support procedures.Formulate planning, budgeting"," Deloitte  Los Angeles, CA, USA",CA,,,,BACHELOR
18,Data Analyst,ACI Federal™,5+ years data science analyst experience. Creating and editing/updating data scripts using R for use by TIU. Cyber Threat Intelligence Analysis and Reporting.,"Falls Church, VA",VA,$39.38 an hour,,R,
19,Data Scientist,"Forward Air, Inc.",Present information using data VISUALIZATION techniques. Work with stakeholders throughout the organization to identify opportunities for leveraging company…,"Forest Park, GA +1 location",GA,"$85,000 - $120,000 a year",,VISUALIZATION,
20,Data Scientist,Permanent General Assurance Corp.,"As an Associate Data Scientist, you will be involved first hand with actual data science projects and writing code that matters.","Nashville, TN",TN,"$76,440 a year",,,
21,Data Analyst,Nova Collective,"Working with raw survey data to produce clean data sets for analysis and reporting. Do you bring a strong background in survey data principles, such as:","Chicago, IL",IL,$30 - $35 an hour,,,
22,Data Analyst,Quality Built,"Support the design of end-to-end data VISUALIZATIONs/Reporting solutions, from data extraction to the presentation, to address the clients’ needs.","Denver, CO +4 locations",CO,"$65,000 - $80,000 a year",,,
23,Data Engineer,Central Intelligence Agency,"Work experience related to data engineering, information, and data management. Data Engineers work with data consumers to create and populate optimal data…","Washington, DC",DC,"$64,137 - $159,286 a year",,,
24,Data Analyst,Atlas Executive Consulting,"User interface design and prototyping data VISUALIZATIONs. 4 years of experience developing, implementing, and supporting the usage of data VISUALIZATION…","North Charleston, SC +1 location",SC,"$95,000 a year",,,
25,Data Scientist,Millennium Software Solutions,"Clustering of mixed event, real time data in order to determine clear operating regimes. The event data is process alarms from a refinery, chemical plant or…","West Kingston, RI",RI,$70 - $75 an hour,,,
26,Data Analyst,Intellisoft Inc,"Conduct data quality assurance activities, including the identification and resolution of data errors. MASTER  Degree or higher in STATISTICSs, data science,…","Atlanta, GA",GA,$55 - $65 an hour,,,MASTER
27,Data Scientist,GovStrive LLC,"Support the collection, preparation, and management of client data and publicly available datasets such as the Federal Employee.","Dublin, GA",GA,,,,
28,Data Scientist,University of Maryland,"Experience querying data  BACHELOR  s and large data sets to combine and manipulate data (e.g., import data, assess missingness, filter, transform variables, derive…","College Park, MD",MD,,,,BACHELOR
29,Data Scientist,Tekshapers Inc,"Experience with building/tuning models inferencing against time series data. To create all quality documents, collect metrics data and conducting Audits.","Rahway, NJ",NJ,$60 - $65 an hour,,,
30,Data Scientist,"Continental Finance Company, LLC",Creating complex data VISUALIZATIONs in VISUALIZATION. Creating complex custom data queries in SQL. Creating complex data models in SAS or R or PYTHON.,"Wilmington, DE",DE,"$80,000 - $100,000 a year",,R,
31,Data Scientist,Delaware Nation Industries,Work with social science researchers to identify relevant data needs for policy-oriented research purposes. Contribute to and help maintain data structure for a…,"Washington, DC +1 location",DC,"$130,000 - $140,000 a year",,,
32,Data Scientist,FinTek Solutions LLC,"8+ years of OR, STATISTICSal or data mining algorithm development experience, including 5+ years of AI/ML development experience for real-world applications.","Atlanta, GA",GA,$45 - $50 an hour,,,
33,Data Analyst,Quizlet,"You will be the owner and expert of subscriptions data, enabling you to identify new high-value opportunities, analyze A/B test experiments, recommend data…","San Francisco, CA",CA,,,,
34,Data Scientist,PrimeNeuro,"  PHD  .  MASTER ’s in data science, bioinformatics, or a closely related field or   BACHELOR   with 3-5 years of post-degree work experience.","Durham, NC +3 locations",NC,"$95,000 - $105,000 a year",,,"PHD,BACHELOR,MASTER"
35,Data Engineer,Awning,"Integrate third-party data sources with our data infrastructure. You'll also support with data science, ML, and engineering work we do.","San Francisco, CA",CA,,,,
36,Data Scientist,"Denali System Co., Ltd","Data science: 3 years (Preferred). Proven Experience in working with large scale data systems. Formulating, suggesting, and managing data-driven projects which…","Mountain View, CA",CA,,,,
37,Data Analyst,Tampa Bay Rays,Our R&D group helps shape the   BACHELOR  ball Operations decision-making processes through the analysis and interpretation of data. Experience with R or PYTHON.,"Saint Petersburg, FL",FL,,,R,BACHELOR
38,Data Analyst,National Independent Statistical Service,This individual corresponds with company contacts when problems are identified and assists in resolving data questions.,"Indianapolis, IN",IN,,,,
39,Data Scientist,United Solutions LLC,Strong experience in manipulating data and drawing insights from large data sets. Experience working with and creating data architectures.,"Rockville, MD",MD,"$50,000 - $120,000 a year",,,
40,Data Scientist,Atlas Executive Consulting,Minimum four (4) years of experience developing data analytics or data science solutions. Ability to manipulate data from multiple structured and unstructured…,"North Charleston, SC",SC,"$70,000 - $85,000 a year",,,
41,Data Scientist,TARGET PHARMASOLUTIONS,Aggregate and organize data from disparate sources in support of data analysis. Knowledge of healthcare/clinical data desired.,"Durham, NC",NC,,,,
42,Data Analyst,Orlando City SC,"Degree in computer science, math, data science or related field or a combination of education and 1-2 years experience in STATISTICSal analysis and report…","Orlando, FL",FL,,,,
43,Data Scientist,Tripoint Solutions,Conduct data analysis tasks in conjunction with client data SMEs. This position requires the applicant to parse disparate data sources to find the patterns and…,"Alexandria, VA +1 location",VA,"$90,000 - $95,000 a year",,,
44,Data Engineer,CreditXpert,"Closely collaborate with operations and data science to create scalable solutions for product problems. Manage data and meta-data, structuring it properly via…","Baltimore, MD",MD,"$96,980 - $153,326 a year",,,
45,Data Analyst,"Redaptive, Inc.",The Quantitative Data Analyst at Redaptive leverages any and all available data to answer Redaptive’s critical questions.,United States,US National,,,,
46,Data Scientist,Numerdox,"You will be performing thorough testing and validation of models, and support various aspects of the   BACHELOR  ness with data analytics.","Sacramento, CA",CA,,,,BACHELOR
47,Data Scientist,Titan America,"Experience with common data science toolkits, such as R, PYTHON. Extending company’s data with third party sources of information when needed.","Roanoke, VA",VA,,,,
48,Data Scientist,The General Insurance,"As an Associate Data Scientist, you will be involved first hand with actual data science projects and writing code that matters.","Nashville, TN",TN,,,,
49,Data Analyst,General Motors,Our Data Analytics team supports operational improvement and   BACHELOR  ness decision-making through ad-hoc STATISTICSal analysis of curated enterprise data and self…,Michigan,MI,,,,BACHELOR
50,Data Scientist,Utility Associates,Identify valuable data sources and automate the collection of data. Our plan is to build a data science team that will help us gain valuable insights from…,"Decatur, GA",GA,"$110,000 - $135,000 a year",,,
51,Data Scientist,Doorstead,Extending company's data with third party sources of information when needed. Enhancing data collection procedures to include information that is relevant for…,"San Francisco, CA",CA,,,,
52,Data Scientist,IBM,Determine the appropriate data collections methods   BACHELOR  d on the unique data structure and elements. The role will involve working with the CIO Data Lake and…,"Research Triangle Park, NC",NC,,,,BACHELOR
53,Data Scientist,Starbucks,"Understands how to break down the data, extract insights, and determine utility within larger data analytic products.","Seattle, WA",WA,,,,
54,Data Analyst,Trend Health Partners,Interpret and analyze data to accurately assess and demonstrate key insights into trends and opportunities. Trend Health Partners is currently seeking analysts…,"Hunt Valley, MD",MD,"$50,000 - $60,000 a year",,,
55,Data Analyst,SymphonyRM,Experience using dbt to transform data. Transform and model data using dbt and LookML. Visualize data to communicate findings using platforms such as Excel or…,Pennsylvania,PA,,,,
56,Data Analyst,The New York Times,Democratize data and insights through skillful data structuring and use of VISUALIZATION tools. Collaborate with data science and tech to bring to life new…,"New York, NY",NY,,,VISUALIZATION,
57,Data Analyst,"Metron, Inc.",Conduct data collection and specification reviews. Perform post-processing data analysis and interpretation. Participate in customer meetings and briefings.,"Hanahan, SC +1 location",SC,,,,
58,Data Analyst,Homeless Services Network of Central Florida,Disseminate data regarding data quality and system performance measures. Assists in monitoring and providing regular updates to the organization’s management…,"Orlando, FL",FL,"$45,000 - $53,000 a year",,,
59,Data Engineer,Ascendum,"Knowledge in three of the following technical disciplines: data warehousing, big data management, analytics development, data science, application programming…","Cincinnati, OH",OH,,,,
60,Data Analyst,Optimal Solutions Group,Self-motivation and interest in data-driven public policy analysis a must. The Research Analyst(s) would assist senior researchers in a variety of research and…,"College Park, MD",MD,,,,
61,Data Scientist,Recovery Centers of America,"Strong knowledge of Data Science, Data structures, data modelling and software architecture. Reporting to the CTO, the ideal candidate will have great problem…","King of Prussia, PA",PA,,,,
62,Data Scientist,"Pharma Resource Group, Inc.",Support the safety science eﬀort to build applications and tools by applying advanced scientific algorithms and methods and translating the strategic vision of…,"Fort Washington, PA",PA,,,,
63,Data Scientist,Optimal Solutions Group,"Assist Data Scientists in developing data products that contain dynamic data VISUALIZATIONs to present findings, data explorers that allow users to explore and…","College Park, MD",MD,,,,
64,Data Scientist,Brilliant Infotech,"Solid experience performing data science from data discovery, cleaning, model selection, validation, and deployment; experience coding artificial intelligence…","Ewing, NJ",NJ,"$111,000 - $122,000 a year",,,
65,Data Analyst,"Decision Information Resources, Inc","Master’s degree with coursework in data analysis or data science. Additionally, the ability to set up a platform for data VISUALIZATION is preferred.","Washington, DC",DC,"$65,000 - $80,000 a year",,VISUALIZATION,
66,Data Analyst,"Naval Systems, Inc.",Write tools to assist in mining data from various Navy and DoD data sources. Assist in the assessment and accuracy of new data sources and data gathering…,"Lexington Park, MD",MD,,,,
67,Data Scientist,Franklin IQ,Gathering data via advanced computerized models. Developing and revising existing data models. Extracting patterns of data through high-level algorithms.,"Arlington, VA",VA,$50 - $70 an hour,,,
68,Data Scientist,KBR,"Engineering Support: Participates with engineering in the design, development, and utilization of scientific/engineering electronic data processing systems…","Lexington Park, MD",MD,,,,
69,Data Scientist,EpochGeo,"Our developers, analysts, and data scientists have a proven track record applying open-source innovative technology, data science, and actionable analytics to…","Washington, DC +2 locations",DC,"$100,000 - $200,000 a year",,,
70,Data Analyst,Blizzard Entertainment,"Demonstrated experience with some or all of the following: data modeling, data VISUALIZATION, STATISTICSs, experimental design, predictive modeling.","Irvine, CA",CA,,,,
71,Data Analyst,Elutions,Perform STATISTICSal data analysis and STATISTICSal modelling with high quality data handling techniques. Incorporate process of continuous improvements into day…,"Tampa, FL",FL,,,,
72,Data Analyst,BSquared Consulting,8+ years of total data analyst experience required. O  BACHELOR  n data through advanced computerized models; extrapolate data patterns through advanced algorithms;…,"Washington, DC",DC,"$100,000 - $108,000 a year",,,BACHELOR
73,Data Analyst,Venga Global,This will help our team gather enough data to teach computers to identify the same traits. Additional special projects may be assigned if time allows.,North Carolina,NC,$15 an hour,,,
74,Data Scientist,EchoStar,Develop custom ML data models and algorithms to apply to data sets. Assess the effectiveness and accuracy of new data sources and data gathering techniques.,"Germantown, MD",MD,,,ML,
75,Data Analyst,Driveway Home Office,"1-3 years of experience in data analysis with emphasis on data and analytics. Developing and implementing data analyses, data collection systems and other…",North Carolina,NC,,,,
76,Data Analyst,Metropolitan Atlanta Rapid Transit Authority (MARTA),"Responsible for   BACHELOR  ness analytics work through all phases, including data quality, automation, data analysis, data VISUALIZATION, and presentation of results.","Atlanta, GA",GA,"$60,000 - $90,000 a year",,,BACHELOR
77,Data Analyst,The Voter Participation Center / Center for Voter Information,"Previous experience in political data. Previous experience crafting narratives from unstructured data. Collect, clean, and process data sets.","Washington, DC",DC,"$65,000 - $75,000 a year",,,
78,Data Analyst,Florida Blue,"Intermediate Excel skills Desire to continue to improve computational, STATISTICSal, behavioral and data science skills. Knowledge of R is a plus.",United States,US National,,,R,
79,Data Scientist,Walmart,"  BACHELOR  's degree in data science, applied mathematics, computer science or otherwise research-  BACHELOR  d field; Master’s degree required.","Dallas, TX +2 locations",TX,,,,BACHELOR
80,Data Scientist,"Interos, Inc.",Developing custom data models and algorithms to apply to data sets. Assessing the effectiveness and accuracy of new data sources and data gathering techniques.,Virginia,VA,,,,
81,Data Analyst,Passion,"Degree in computer science, data science, or equivalent education and experience preferred. Assists with providing data driven solutions.","Atlanta, GA",GA,,,,
82,Data Analyst,Instacart,Investigate and solve complex data issues such as data bugs that impact critical metrics. Deploy data quality checks and ensure high quality of VISUALIZATIONs and…,"San Francisco, CA",CA,,,,
83,Data Engineer,PagerDuty,"Demonstrated experience with data modeling, data  BACHELOR   design, extract transform load (ETL) processes, working with unstructured data, and cloud-  BACHELOR  d data…",California,CA,,,,BACHELOR
84,Data Scientist,Innovyt,"In this role, you will work on some of the latest applications of data science to   BACHELOR  ness. We are looking for candidates with minimum of 3-5 years of…","San Jose, CA +1 location",CA,"$110,000 - $150,000 a year",,,BACHELOR
85,Data Scientist,Geospark Analytics,"We are a small team where you will have autonomy to create, train, test, develop, and deploy new models on a regular   BACHELOR  s.",United States,US National,,,,BACHELOR
86,Data Analyst,Applecart,"Interest in or passion for politics, the legislative process, technology, data analytics, and data science. Partner with other data analysts to build predictive…","New York, NY",NY,,,,
87,Data Analyst,MMIT,"Experience analyzing large healthcare data sets, such as claims and formulary coverage data, and synthesize patterns into actionable feedback to Product and…","Yardley, PA",PA,,,,
88,Data Engineer,Bloom Insurance,Knowledge of data science technologies is a plus. Able to generate ad hoc data on demand. Design data models and develop data  BACHELOR   structures in Microsoft SQL…,"Bloomington, IN",IN,,,,BACHELOR
89,Data Analyst,Eleanor Health,"Be the data expert supporting cross-functional teams, gathering data from various sources, and building automated reporting to democratize data across the…",Massachusetts,MA,,,,
